Reference Seq,Position,Mutation Type,Sequence Change,Gene,Function,Product,GO Process,GO Component,Details,TOL hexamethylenediamine A1 F50 I1 R1,TOL hexamethylenediamine A2 F50 I1 R1,TOL hexamethylenediamine A2 F50 I2 R1,TOL hexamethylenediamine A3 F50 I1 R1,TOL hexamethylenediamine A3 F50 I2 R1,TOL hexamethylenediamine A3 F50 I3 R1,TOL hexamethylenediamine A4 F50 I1 R1,TOL hexamethylenediamine A4 F50 I2 R1,TOL hexamethylenediamine A4 F50 I3 R1,TOL hexamethylenediamine A5 F50 I1 R1,TOL hexamethylenediamine A5 F50 I2 R1,TOL hexamethylenediamine A5 F50 I3 R1,TOL hexamethylenediamine A6 F50 I1 R1,TOL hexamethylenediamine A6 F50 I2 R1,TOL hexamethylenediamine A7 F50 I1 R1,TOL hexamethylenediamine A7 F50 I2 R1,TOL hexamethylenediamine A7 F50 I3 R1,TOL hexamethylenediamine A8 F50 I1 R1,TOL hexamethylenediamine A8 F50 I2 R1,TOL hexamethylenediamine A8 F50 I3 R1
NC_000913,3816611,SNP,C→A,"rph, yicC",,"ribonuclease PH (defective),enzyme, Degradation of RNA, RNase PH/UPF0701 family protein",,,intergenic (‑62/‑65),1,,,,,,,,,,,,,,,,,,,
NC_000913,3823025,SNP,G→A,spoT,,"bifunctional (p)ppGpp synthetase II/ guanosine-3',5'-bis pyrophosphate 3'-pyrophosphohydrolase",,,R209H (CGT→CAT),1,,,,,,,,,,,,,,,,,,,
NC_000913,4181786,SNP,G→T,rpoB,,"RNA polymerase, beta subunit",,,G181V (GGT→GTT),1,,,,,,,,,,,,,,,,,,,
NC_000913,4257602,SNP,A→T,lexA,,transcriptional repressor of SOS regulon,,,N163I (AAT→ATT),1,,,,,,,,,,,,,,,,,,,
NC_000913,146566,SNP,G→A,panD,,aspartate 1-decarboxylase,,,A43A (GCC→GCT),,,,,,,1,,,,,,,,,,,,,
NC_000913,569541,DEL,Δ1 bp,ybcK,,"DLP12 prophage, putative recombinase",,,coding (640/1527 nt),,,,,,,1,,,,,,,,,,,,,
NC_000913,656251,SNP,C→T,"dcuC, pagP",,anaerobic C4-dicarboxylate transport/phospholipid:lipid A palmitoyltransferase,,,intergenic (‑283/‑306),,,,,,,1,,,,,,,,,,,,,
NC_000913,1238213,SNP,G→C,dadA,,D-amino acid dehydrogenase,,,G215R (GGG→CGG),,,,,,,1,,,,,,,,,,,,,
NC_000913,1474862,SNP,C→G,ydbC,,putative NAD(P)-binding oxidoreductase,,,G214G (GGC→GGG),,,,,,,1,,,,,,,,,,,,,
NC_000913,1641252,SNP,T→C,"essQ, cspB",,"Qin prophage, putative S lysis protein/Qin prophage, cold shock protein",,,intergenic (‑667/+87),,,,,,,1,,,,,,,,,,,,,
NC_000913,1643723,SNP,T→C,ydfU,,"Qin prophage, uncharacterized protein",,,K194K (AAA→AAG),,,,,,,1,,,,,,,,,,,,,
NC_000913,1671752,SNP,A→G,"asr, ydgU",,acid shock-inducible periplasmic protein/stationary phase-induced protein,,,intergenic (+68/‑25),,,,,,,1,,,,,,,,,,,,,
NC_000913,1719444,SNP,C→T,anmK,,anhydro-N-acetylmuramic acid kinase,,,Q53Q (CAG→CAA),,,,,,,1,,,,,,,,,,,,,
NC_000913,1729289,SNP,G→A,lhr,,putative ATP-dependent helicase,,,R68Q (CGG→CAG),,,,,,,1,,,,,,,,,,,,,
NC_000913,1817424,SNP,A→G,chbF,,"phospho-chitobiase, general 6-phospho-beta-glucosidase activity",,,C359C (TGT→TGC),,,,,,,1,,,,,,,,,,,,,
NC_000913,1842587,SNP,C→T,gdhA,,"glutamate dehydrogenase, NADP-specific",,,Q73* (CAG→TAG),,,,,,,1,,,,,,,,,,,,,
NC_000913,2509609,SNP,A→C,"glk, yfeO",,glucokinase/putative ion channel protein,,,intergenic (‑183/‑21),,,,,,,1,,,,,,,,,,,,,
NC_000913,3214148,SNP,G→A,rpoD,,"RNA polymerase, sigma 70 (sigma D) factor",,,G368S (GGT→AGT),,,,,,,1,,,,,,,,,,,,,
NC_000913,3436622,SNP,T→C,trkA,,NAD-binding component of TrK potassium transporter,,,R35R (CGT→CGC),,,,,,,1,,,,,,,,,,,,,
NC_000913,3584367,SNP,C→T,"yrhA, yrhB",,"pseudogene, interrupted by IS1E/stable heat shock chaperone",,,intergenic (+58/‑392),,,,,,,1,,,,,,,,,,,,,
NC_000913,3677182,INS,(T)6→7,yhjG,,putative inner membrane-anchored periplasmic AsmA family protein,,,coding (1169/2061 nt),,,,,,,1,,,,,,,,,,,,,
NC_000913,3736471,SNP,A→G,bax,,putative glucosaminidase,,,V236A (GTG→GCG),,,,,,,1,,,,,,,,,,,,,
NC_000913,4181706,SNP,C→T,rpoB,,"RNA polymerase, beta subunit",,,G154G (GGC→GGT),,,,,,,1,,,,,,,,,,,,,
NC_000913,691774,DEL,Δ12 bp,[ybeX],,[ybeX],,,,,,,,1,,,,,,,,,,,,,,,
NC_000913,701405,SNP,C→A,nagC,,N-acetylglucosamine-inducible nag divergent operon transcriptional repressor,,,E64* (GAA→TAA),,,,,1,,,,,,,,,,,,,,,
NC_000913,2879763,SNP,G→A,ygbT,,"multifunctional endonuclease Cas1, CRISPR adaptation protein, DNA repair enzyme",,,L4F (CTT→TTT),,,,,1,,,,,,,,,,,,,,,
NC_000913,2991218,SNP,A→G,"ygeF, ygeG",,pseudogene/SycD-like chaperone family TPR-repeat-containing protein,,,intergenic (+175/‑50),,,,,1,,,,,,,,,,,,,,,
NC_000913,367852,DEL,(GC)6→5,mhpR,,mhp operon transcriptional activator,,,coding (568‑569/834 nt),,,,,,,,,1,,,,,,,,,,,
NC_000913,1785280,SNP,G→A,ppsA,,phosphoenolpyruvate synthase,,,G611G (GGC→GGT),,,,,,,,1,,,,,,,,,,,,
NC_000913,2104077,DEL,(T)8→7,wbbK,,lipopolysaccharide biosynthesis protein,,,coding (433/1119 nt),,,,,,,,,,,,,,,1,,1,,,
NC_000913,2804835,DEL,Δ7 bp,proV,,glycine betaine/proline ABC transporter periplasmic binding protein,,,coding (21‑27/1203 nt),,,,,,,,,,,,,1,1,,,,,,
NC_000913,2804864,DEL,Δ13 bp,proV,,glycine betaine/proline ABC transporter periplasmic binding protein,,,coding (50‑62/1203 nt),1,,,,,,,,,,,,,,,,,1,1,1
NC_000913,4296381,INS,+GC,"gltP, yjcO",,glutamate/aspartate:proton symporter/Sel1 family TPR-like repeat protein,,,intergenic (+587/+55),1,1,1,1,1,1,1,1,1,1,1,1,1,1,1,1,1,1,1,1
NC_000913,1426023,SNP,A→G,ydaY,,"pseudogene, Rac prophage,Phage or Prophage Related",,,pseudogene (394/453 nt),,,,,,,,,1,,,,,,,,,,,
NC_000913,1978503,DEL,Δ776 bp,"insB1, insA",,"insB1, insA",,,,1,1,1,1,1,1,1,1,1,1,1,1,1,1,1,1,1,1,1,1
NC_000913,1299499,DEL,"Δ1,199 bp","ychE, oppA",,UPF0056 family inner membrane protein/oligopeptide ABC transporter periplasmic binding protein,,,intergenic (+254/‑485),,,,,,,,,,,,,,1,,,,,,
NC_000913,2173363,DEL,Δ2 bp,"gatC, gatC",,"pseudogene, galactitol-specific enzyme IIC component of PTS,transport, Transport of small molecules: Carbohydrates, organic acids, alcohols, PTS system galactitol-specific enzyme IIC/pseudogene, galactitol-specific enzyme IIC component of PTS,transport, Transport of small molecules: Carbohydrates, organic acids, alcohols, PTS system galactitol-specific enzyme IIC",,,intergenic (‑1/+1),1,1,1,1,1,1,1,1,1,1,1,1,1,1,1,1,1,1,1,1
NC_000913,3560455,INS,+G,"glpR, glpR",,"pseudogene, DNA-binding transcriptional repressor,regulator, Energy metabolism, carbon: Anaerobic respiration, repressor of the glp operon/pseudogene, DNA-binding transcriptional repressor,regulator, Energy metabolism, carbon: Anaerobic respiration, repressor of the glp operon",,,intergenic (‑2/+1),1,1,1,1,1,1,1,1,1,1,1,1,1,1,1,1,1,1,1,1
NC_000913,2966573,SNP,T→G,ptsP,,"PEP-protein phosphotransferase enzyme I, GAF domain containing protein",,,D621A (GAT→GCT),,,,,,,,,,1,1,1,,,,,,,,
NC_000913,3815859,DEL,Δ82 bp,"[rph], [rph]",,"[rph], [rph]",,,,,,,,,,1,1,1,,,,1,1,,,,,,
NC_000913,4628246,SNP,A→C,nadR,,"trifunctional protein: nicotinamide mononucleotide adenylyltransferase, ribosylnicotinamide kinase, transcriptional repressor",,,D311A (GAT→GCT),,,,,,,,,,,,,1,1,,,,,,
NC_000913,380022,INS,(G)10→11,"frmR, yaiO",,regulator protein that represses frmRAB operon/outer membrane protein,,,intergenic (‑141/+47),,,,,,,1,,,,,,,,,,,,,
NC_000913,1526968,SNP,T→G,yncH,,IPR020099 family protein,,,L10R (CTC→CGC),,,,,,,,,,,,,1,1,,,,,,
NC_000913,4410053,DEL,(T)9→8,"rlmB, yjfI",,"23S rRNA mG2251 2'-O-ribose methyltransferase, SAM-dependent/DUF2170 family protein",,,intergenic (+47/‑80),,,,,,,1,1,1,,,,,,,,,,,
NC_000913,1196220,SNP,C→T,icd,,"isocitrate dehydrogenase, e14 prophage attachment site, tellurite reductase",,,H366H (CAC→CAT),,,,,,,,,,,,,1,1,,,,,,
NC_000913,1196232,SNP,C→T,icd,,"isocitrate dehydrogenase, e14 prophage attachment site, tellurite reductase",,,T370T (ACC→ACT),,,,,,,,,,,,,1,1,,,,,,
NC_000913,1196245,SNP,T→C,icd,,"isocitrate dehydrogenase, e14 prophage attachment site, tellurite reductase",,,L375M (TTA→CTG),,,,,,,,,,,,,1,1,,,,,,
NC_000913,1196247,SNP,A→G,icd,,"isocitrate dehydrogenase, e14 prophage attachment site, tellurite reductase",,,L375M (TTA→CTG),,,,,,,,,,,,,1,1,,,,,,
NC_000913,3815810,DEL,Δ1 bp,"pyrE, rph",,"orotate phosphoribosyltransferase/ribonuclease PH (defective),enzyme, Degradation of RNA, RNase PH",,,intergenic (‑42/+24),,,,1,1,1,,,,1,1,1,,,,,,,,
NC_000913,3815808,DEL,(A)8→7,"pyrE, rph",,"orotate phosphoribosyltransferase/ribonuclease PH (defective),enzyme, Degradation of RNA, RNase PH",,,intergenic (‑40/+26),,1,1,,,,,,,,,,,,,,,1,1,1
NC_000913,700602,MOB,IS1 (+) +9 bp,nagC,,N-acetylglucosamine-inducible nag divergent operon transcriptional repressor,,,coding (985‑993/1221 nt),,,,,,,,,,1,1,,,,,,,,,
NC_000913,1594132,INS,(C)8→9,yneO,,"pseudogene, AidA homolog",,,pseudogene (3856/3861 nt),,,,,,,1,,,,,,,,,,,,,
NC_000913,4378331,SNP,A→G,ampC,,"penicillin-binding protein, beta-lactamase, intrinsically weak",,,I205T (ATT→ACT),,,,,,,,,,1,,,,,,,,,,
NC_000913,67483,SNP,C→T,araA,,L-arabinose isomerase,,,L285L (CTG→CTA),,,,,,,,,1,,,,,,,,,,,
NC_000913,82372,SNP,T→C,leuA,,2-isopropylmalate synthase,,,E386E (GAA→GAG),,,,,,,1,1,1,,,,,,,,,,,
NC_000913,757037,SNP,T→C,sdhA,,"succinate dehydrogenase, flavoprotein subunit",,,D377D (GAT→GAC),,,,,,,,,1,,,,,,,,,,,
NC_000913,809038,SNP,C→T,bioA,,"7,8-diaminopelargonic acid synthase, PLP-dependent",,,A74T (GCC→ACC),,,,,,,1,1,1,,,,,,,,,,,
NC_000913,940856,SNP,A→G,"serS, dmsA",,"seryl-tRNA synthetase/dimethyl sulfoxide reductase, anaerobic, subunit A",,,intergenic (+136/‑103),,,,,,,,,1,,,,,,,,,,,
NC_000913,962923,SNP,A→G,rpsA,,30S ribosomal subunit protein S1,,,D310G (GAC→GGC),,,,,,,1,1,1,,,,,,,,,,,
NC_000913,1198201,SNP,C→T,ymfE,,"e14 prophage, putative inner membrane protein",,,E13K (GAA→AAA),,,,,,,1,1,1,,,,,,,,,,,
NC_000913,1349856,SNP,T→C,yciW,,putative oxidoreductase,,,E84E (GAA→GAG),,,,,,,1,1,1,,,,,,,,,,,
NC_000913,1488624,SNP,T→C,aldA,,"aldehyde dehydrogenase A, NAD-linked",,,R131R (CGT→CGC),,,,,,,1,1,1,,,,,,,,,,,
NC_000913,1500389,DEL,(T)8→7,ydcK,,uncharacterized protein,,,coding (61/981 nt),,,,,,,,,1,,,,,,,,,,,
NC_000913,1785500,INS,+T,ppsA,,phosphoenolpyruvate synthase,,,coding (1613/2379 nt),,,,,,,,,1,,,,,,,,,,,
NC_000913,1953212,SNP,G→A,cmoA,,carboxy-SAM synthase,,,A171T (GCC→ACC),,,,,,,1,1,1,,,,,,,,,,,
NC_000913,2096825,SNP,T→C,hisI,,phosphoribosyl-AMP cyclohydrolase and phosphoribosyl-ATP pyrophosphatase,,,F71S (TTC→TCC),,,,,,,,,1,,,,,,,,,,,
NC_000913,2181988,SNP,G→A,yegV,,putative kinase,,,W298* (TGG→TAG),,,,,,,1,1,1,,,,,,,,,,,
NC_000913,2369371,SNP,G→A,arnA,,fused UDP-L-Ara4N formyltransferase/UDP-GlcA C-4'-decarboxylase,,,D445N (GAT→AAT),,,,,,,1,1,1,,,,,,,,,,,
NC_000913,2524685,SNP,T→A,xapA,,"purine nucleoside phosphorylase 2, nicotinamide 1-beta-D-riboside synthase",,,H65L (CAT→CTT),,,,,,,,,1,,,,,,,,,,,
NC_000913,2619803,SNP,A→G,uraA,,uracil permease,,,F120L (TTT→CTT),,,,,,,1,1,1,,,,,,,,,,,
NC_000913,2673499,SNP,C→T,yphA,,DoxX family inner membrane protein,,,P52S (CCA→TCA),,,,,,,,,1,,,,,,,,,,,
NC_000913,2805832,MOB,IS1 (–) +9 bp,proV,,glycine betaine/proline ABC transporter periplasmic binding protein,,,coding (1018‑1026/1203 nt),,,,,,,1,1,1,,,,,,,,,,,
NC_000913,2850439,SNP,C→T,"hycA, hypA",,regulator of the transcriptional regulator FhlA/protein involved in nickel insertion into hydrogenases 3,,,intergenic (‑4/‑208),,,,,,,,,1,,,,,,,,,,,
NC_000913,2859224,INS,(GGCGTG)2→3,mutS,,methyl-directed mismatch repair protein,,,coding (2132/2562 nt),,,,,,,1,1,1,,,,,,,,,,,
NC_000913,2860556,SNP,G→A,ygbI,,DeoR family putative transcriptional regulator,,,Q227* (CAG→TAG),,,,,,,,,1,,,,,,,,,,,
NC_000913,3016617,SNP,G→A,ygfK,,putative Fe-S subunit oxidoreductase subunit,,,L186L (CTG→CTA),,,,,,,1,1,1,,,,,,,,,,,
NC_000913,3174815,SNP,C→T,parE,,"DNA topoisomerase IV, subunit B",,,L194L (TTG→TTA),,,,,,,,,1,,,,,,,,,,,
NC_000913,3226782,SNP,C→T,ygjI,,putative transporter,,,D183D (GAC→GAT),,,,,,,,,1,,,,,,,,,,,
NC_000913,3235823,SNP,G→A,rlmG,,"23S rRNA m(2)G1835 methyltransferase, SAM-dependent",,,A18V (GCG→GTG),,,,,,,,,1,,,,,,,,,,,
NC_000913,3271629,SNP,T→C,garK,,glycerate kinase I,,,T48A (ACG→GCG),,,,,,,,,1,,,,,,,,,,,
NC_000913,3291373,SNP,G→A,yraK,,putative fimbrial-like adhesin protein,,,L11L (TTG→TTA),,,,,,,1,1,1,,,,,,,,,,,
NC_000913,3576956,SNP,A→G,gntU,,"gluconate transporter, low affinity GNT 1 system",,,S36P (TCC→CCC),,,,,,,,,1,,,,,,,,,,,
NC_000913,3624042,INS,(G)6→7,yrhC,,pseudogene fragment,,,pseudogene (156/351 nt),,,,,,,,,1,,,,,,,,,,,
NC_000913,3823861,SNP,C→T,spoT,,"bifunctional (p)ppGpp synthetase II/ guanosine-3',5'-bis pyrophosphate 3'-pyrophosphohydrolase",,,R488C (CGT→TGT),,,,,,,1,1,1,,,,,,,,,,,
NC_000913,3901405,SNP,C→T,bglH,,"carbohydrate-specific outer membrane porin, cryptic",,,L272L (CTG→CTA),,,,,,,1,1,1,,,,,,,,,,,
NC_000913,3922549,INS,(C)5→6,"atpI, rsmG",,"ATP synthase, membrane-bound accessory factor/16S rRNA m(7)G527 methyltransferase, SAM-dependent, glucose-inhibited cell-division protein",,,intergenic (‑109/+508),,,,,,,,,1,,,,,,,,,,,
NC_000913,3923204,SNP,G→A,rsmG,,"16S rRNA m(7)G527 methyltransferase, SAM-dependent, glucose-inhibited cell-division protein",,,G159G (GGC→GGT),,,,,,,1,1,1,,,,,,,,,,,
NC_000913,3951681,SNP,T→C,ilvG,,"pseudogene, acetolactate synthase 2 large subunit, valine-insensitive, acetolactate synthase II, large subunit, cryptic, interrupted",,,pseudogene (140/663 nt),,,,,,,1,1,1,,,,,,,,,,,
NC_000913,3970392,SNP,C→T,wecB,,UDP-N-acetyl glucosamine-2-epimerase,,,P87L (CCA→CTA),,,,,,,1,1,1,,,,,,,,,,,
NC_000913,3990828,SNP,G→A,"hemC, cyaA",,hydroxymethylbilane synthase/adenylate cyclase,,,intergenic (‑62/‑325),,,,,,,,,1,,,,,,,,,,,
NC_000913,4086147,SNP,G→A,fdhD,,formate dehydrogenase formation protein,,,A44A (GCG→GCA),,,,,,,1,1,1,,,,,,,,,,,
NC_000913,4185708,SNP,T→C,rpoC,,"RNA polymerase, beta prime subunit",,,L120P (CTG→CCG),,,,,,,1,1,1,,,,,,,,,,,
NC_000913,4410605,SNP,C→T,yjfJ,,PspA/IM30 family protein,,,A18V (GCG→GTG),,,,,,,1,1,1,,,,,,,,,,,
NC_000913,700980,SNP,G→C,nagC,,N-acetylglucosamine-inducible nag divergent operon transcriptional repressor,,,Y205* (TAC→TAG),,,,,,,,,,,,,,,,,,1,1,1
NC_000913,1728512,SNP,A→C,rnt,,"RNase T, exoribonuclease T, structured DNA 3' exonuclease, RNA processing, DNA repair",,,T56P (ACC→CCC),,,,,,,,,,,,,,,,,,1,1,1
NC_000913,1732811,SNP,G→T,lhr,,putative ATP-dependent helicase,,,S1242I (AGC→ATC),,,,,,,,,,,,,,,,,,1,1,1
NC_000913,1744313,SNP,T→A,mdtK,,multidrug efflux system transporter,,,V286E (GTG→GAG),,,,,,,,,,,,,,,,,,1,1,1
NC_000913,7618,SNP,T→G,yaaJ,,putative transporter,,,Q114H (CAA→CAC),,,,,,,,,,,,,,1,,,,,,
NC_000913,11664,SNP,A→C,yaaI,,UPF0412 family protein,,,D41E (GAT→GAG),,,,,,,,,,,,,1,1,,,,,,
NC_000913,52332,SNP,A→C,rsmA,,"16S rRNA m(6)A1518, m(6)A1519 dimethyltransferase, SAM-dependent",,,I33M (ATT→ATG),,,,,,,,,,,,,1,1,,,,,,
NC_000913,83066,SNP,A→C,leuA,,2-isopropylmalate synthase,,,V155G (GTC→GGC),,,,,,,,,,,,,1,1,,,,,,
NC_000913,111300,SNP,T→C,mutT,,dGTP-preferring nucleoside triphosphate pyrophosphohydrolase,,,L86P (CTG→CCG),,,,,,,,,,,,,1,1,,,,,,
NC_000913,112052,SNP,T→G,zapD,,FtsZ stabilizer,,,K183T (AAA→ACA),,,,,,,,,,,,,1,1,,,,,,
NC_000913,156869,SNP,T→G,yadN,,putative fimbrial-like adhesin protein,,,L5F (TTA→TTC),,,,,,,,,,,,,1,1,,,,,,
NC_000913,206330,SNP,T→G,dnaE,,DNA polymerase III alpha subunit,,,F402C (TTC→TGC),,,,,,,,,,,,,1,1,,,,,,
NC_000913,301521,SNP,A→C,paoB,,"PaoABC aldehyde oxidoreductase, FAD-containing subunit",,,Y123D (TAC→GAC),,,,,,,,,,,,,1,1,,,,,,
NC_000913,403627,SNP,T→G,"psiF, yaiC",,"PsiF family protein/diguanylate cyclase, cellulose regualtor",,,intergenic (+26/‑76),,,,,,,,,,,,,,1,,,,,,
NC_000913,430137,SNP,T→G,secF,,SecYEG protein translocase auxillary subunit,,,L211L (CTT→CTG),,,,,,,,,,,,,,1,,,,,,
NC_000913,457616,SNP,T→G,clpX,,ATPase and specificity subunit of ClpX-ClpP ATP-dependent serine protease,,,L64R (CTA→CGA),,,,,,,,,,,,,1,1,,,,,,
NC_000913,511572,SNP,A→C,"copA, glsA",,copper transporter/glutaminase 1,,,intergenic (‑193/‑69),,,,,,,,,,,,,1,1,,,,,,
NC_000913,587023,SNP,A→C,"envY, ybcH",,porin thermoregulatory transcriptional activator/PRK09936 family protein,,,intergenic (‑115/+68),,,,,,,,,,,,,1,1,,,,,,
NC_000913,622725,SNP,A→C,entS,,"enterobactin exporter, iron-regulated",,,E142D (GAA→GAC),,,,,,,,,,,,,1,1,,,,,,
NC_000913,679800,SNP,A→C,ybeU,,DUF1266 family protein,,,Y98S (TAT→TCT),,,,,,,,,,,,,1,1,,,,,,
NC_000913,701839,SNP,T→G,nagA,,N-acetylglucosamine-6-phosphate deacetylase,,,T305P (ACG→CCG),,,,,,,,,,,,,1,1,,,,,,
NC_000913,758662,SNP,A→C,"sdhB, sucA",,"succinate dehydrogenase, FeS subunit/2-oxoglutarate decarboxylase, thiamine triphosphate-binding",,,intergenic (+257/‑44),,,,,,,,,,,,,1,1,,,,,,
NC_000913,798070,SNP,A→C,ybhA,,pyridoxal phosphate (PLP) phosphatase,,,V121G (GTC→GGC),,,,,,,,,,,,,1,1,,,,,,
NC_000913,977748,SNP,T→G,mukB,,"chromosome condensin MukBEF, ATPase and DNA-binding subunit",,,F475V (TTT→GTT),,,,,,,,,,,,,1,1,,,,,,
NC_000913,990447,SNP,A→C,"pncB, pepN",,nicotinate phosphoribosyltransferase/aminopeptidase N,,,intergenic (‑91/‑175),,,,,,,,,,,,,,1,,,,,,
NC_000913,1040032,SNP,T→G,cbdB,,"cytochrome bd-II oxidase, subunit II",,,L246R (CTG→CGG),,,,,,,,,,,,,1,1,,,,,,
NC_000913,1113464,SNP,T→G,"opgH, yceK",,"OPG biosynthetic ACP-dependent transmembrane UDP-glucose beta-1,2 glycosyltransferase, nutrient-dependent cell size regulator, FtsZ assembly antagonist/outer membrane integrity lipoprotein",,,intergenic (+58/‑115),,,,,,,,,,,,,1,1,,,,,,
NC_000913,1188512,SNP,A→C,phoQ,,sensory histidine kinase in two-component regulatory system with PhoP,,,L422* (TTA→TGA),,,,,,,,,,,,,1,1,,,,,,
NC_000913,1221238,SNP,T→G,ycgH,,"pseudogene, putative ATP-binding component of a transport system",,,pseudogene (1638/2574 nt),,,,,,,,,,,,,1,1,,,,,,
NC_000913,1335050,SNP,T→G,"cysB, ymiA",,"N-acetylserine-responsive cysteine regulon transcriptional activator, autorepressor/uncharacterized protein",,,intergenic (+221/‑74),,,,,,,,,,,,,1,1,,,,,,
NC_000913,1353128,SNP,C→A,sapD,,antimicrobial peptide ABC transporter ATPase,,,V167V (GTG→GTT),,,,,,,,,,,,,1,1,,,,,,
NC_000913,1367147,SNP,T→G,pspF,,psp operon transcriptional activator,,,K256Q (AAA→CAA),,,,,,,,,,,,,1,1,,,,,,
NC_000913,1459435,SNP,A→C,paaH,,"3-hydroxyadipyl-CoA dehydrogenase, NAD+-dependent",,,I128L (ATT→CTT),,,,,,,,,,,,,1,1,,,,,,
NC_000913,1510771,SNP,T→G,ydcR,,putative DNA-binding transcriptional regulator and putative aminotransferase,,,L257V (TTA→GTA),,,,,,,,,,,,,,1,,,,,,
NC_000913,2682157,INS,(C)7→8,yphG,,DUF4380 domain-containing TPR repeat protein,,,coding (589/3282 nt),,,,,,,,1,,,,,,,,,,,,
NC_000913,1666363,SNP,T→G,clcB,,H(+)/Cl(-) exchange transporter,,,I350S (ATT→AGT),,,,,,,,,,,,,1,1,,,,,,
NC_000913,1698747,SNP,A→C,malI,,transcriptional repressor of Mal regulon,,,I145S (ATC→AGC),,,,,,,,,,,,,1,1,,,,,,
NC_000913,1703763,SNP,A→C,ydgJ,,putative oxidoreductase,,,L182L (CTT→CTG),,,,,,,,,,,,,1,1,,,,,,
NC_000913,1724722,SNP,A→C,"sodC, ydhF",,"superoxide dismutase, Cu, Zn, periplasmic/putative oxidoreductase",,,intergenic (‑67/+14),,,,,,,,,,,,,1,1,,,,,,
NC_000913,1736425,SNP,T→G,ydhP,,"putative MFS transporter, inner membrane protein",,,N289T (AAT→ACT),,,,,,,,,,,,,1,1,,,,,,
NC_000913,1814762,SNP,A→C,katE,,"catalase HPII, heme d-containing",,,K299T (AAA→ACA),,,,,,,,,,,,,1,1,,,,,,
NC_000913,2320618,SNP,T→G,atoS,,sensory histidine kinase in two-component regulatory system with AtoC,,,I192M (ATT→ATG),,,,,,,,,,,,,,1,,,,,,
NC_000913,2461315,SNP,A→C,fadL,,long-chain fatty acid outer membrane transporter,,,K4Q (AAA→CAA),,,,,,,,,,,,,,1,,,,,,
NC_000913,2823793,SNP,A→C,"recA, pncC",,"DNA recombination and repair protein, ssDNA-dependent ATPase, synaptase, ssDNA and dsDNA binding protein, ATP-dependent homologous DNA strand exchanger, recombinase A, LexA autocleavage cofactor/nicotinamide-nucleotide amidohydrolase, NMN amidohydrolase",,,intergenic (‑24/+56),,,,,,,,,,,,,,1,,,,,,
NC_000913,2879197,SNP,T→G,ygbT,,"multifunctional endonuclease Cas1, CRISPR adaptation protein, DNA repair enzyme",,,E192D (GAA→GAC),,,,,,,,,,,,,1,1,,,,,,
NC_000913,2894532,SNP,T→G,ygcP,,putative antiterminator regulatory protein,,,S113A (TCA→GCA),,,,,,,,,,,,,1,1,,,,,,
NC_000913,2924700,SNP,T→G,"csrB, syd",,"CsrA-binding sRNA, antagonizing CsrA regulation/SecY-interacting protein",,,intergenic (‑176/+35),,,,,,,,,,,,,1,1,,,,,,
NC_000913,2955480,SNP,A→C,recB,,"exonuclease V (RecBCD complex), beta subunit",,,L175R (CTG→CGG),,,,,,,,,,,,,1,1,,,,,,
NC_000913,2964902,SNP,T→G,thyA,,thymidylate synthetase,,,D85A (GAT→GCT),,,,,,,,,,,,,1,1,,,,,,
NC_000913,3035568,SNP,A→C,prfB,,peptide chain release factor RF-2,,,D238E (GAT→GAG),,,,,,,,,,,,,1,1,,,,,,
NC_000913,3084656,SNP,T→G,speA,,"biosynthetic arginine decarboxylase, PLP-binding",,,E419A (GAA→GCA),,,,,,,,,,,,,1,1,,,,,,
NC_000913,3104042,SNP,T→G,mutY,,adenine DNA glycosylase,,,L344V (TTA→GTA),,,,,,,,,,,,,,1,,,,,,
NC_000913,3125147,SNP,T→G,glcF,,glycolate oxidase 4Fe-4S iron-sulfur cluster subunit,,,K105Q (AAA→CAA),,,,,,,,,,,,,,1,,,,,,
NC_000913,3181413,SNP,A→C,ygiC,,ATP-Grasp family ATPase,,,E331D (GAA→GAC),,,,,,,,,,,,,,1,,,,,,
NC_000913,3182139,SNP,T→G,ygiD,,"4,5- DOPA-extradiol-dioxygenase",,,Q90P (CAG→CCG),,,,,,,,,,,,,1,1,,,,,,
NC_000913,3213290,SNP,C→A,rpoD,,"RNA polymerase, sigma 70 (sigma D) factor",,,Q82K (CAG→AAG),,,,,,,,,,,,,1,1,,,,,,
NC_000913,3219912,SNP,A→C,patA,,"putrescine:2-oxoglutaric acid aminotransferase, PLP-dependent",,,K140T (AAA→ACA),,,,,,,,,,,,,1,1,,,,,,
NC_000913,3239097,SNP,T→G,alx,,putative membrane-bound redox modulator,,,L173R (CTG→CGG),,,,,,,,,,,,,1,1,,,,,,
NC_000913,3281717,SNP,A→C,"agaA, agaS",,"pseudogene, N-acetylgalactosamine-6-phosphate deacetylase fragment, putative N-acetylgalactosamine-6-phosphate deacetylase/tagatose-6-phosphate ketose/aldose isomerase",,,intergenic (+92/‑259),,,,,,,,,,,,,1,1,,,,,,
NC_000913,3331811,SNP,T→G,yhbE,,EamA family inner membrane putative transporter,,,K309Q (AAG→CAG),,,,,,,,,,,,,1,1,,,,,,
NC_000913,3348462,SNP,T→G,yrbL,,Mg(2+)-starvation-stimulated protein,,,L4* (TTA→TGA),,,,,,,,,,,,,1,1,,,,,,
NC_000913,3349078,SNP,A→C,yrbL,,Mg(2+)-starvation-stimulated protein,,,E209D (GAA→GAC),,,,,,,,,,,,,1,1,,,,,,
NC_000913,3400966,SNP,A→C,mreB,,"cell wall structural complex MreBCD, actin-like component MreB",,,I41S (ATT→AGT),,,,,,,,,,,,,1,1,,,,,,
NC_000913,3511718,SNP,T→G,yhfZ,,putative DNA-binding transcriptional regulator,,,R209R (CGA→CGC),,,,,,,,,,,,,,1,,,,,,
NC_000913,3579268,SNP,A→C,yhhW,,quercetinase activity in vitro,,,I126M (ATT→ATG),,,,,,,,,,,,,,1,,,,,,
NC_000913,3582141,SNP,T→G,yhhZ,,"putative Hcp1 family polymorphic toxin protein, putative colicin-like DNase/tRNase activity",,,N93K (AAT→AAG),,,,,,,,,,,,,1,1,,,,,,
NC_000913,3691406,SNP,T→G,bcsB,,"regulator of cellulose synthase, cyclic di-GMP binding",,,D401A (GAT→GCT),,,,,,,,,,,,,1,1,,,,,,
NC_000913,3823987,SNP,G→T,spoT,,"bifunctional (p)ppGpp synthetase II/ guanosine-3',5'-bis pyrophosphate 3'-pyrophosphohydrolase",,,G530C (GGT→TGT),,,,,,,,,,,,,1,1,,,,,,
NC_000913,3854965,SNP,C→G,emrD,,multidrug efflux system protein,,,G348G (GGC→GGG),,,,,,,,,,,,,1,1,,,,,,
NC_000913,3891019,SNP,T→G,tnaB,,tryptophan transporter of low affinity,,,S262A (TCC→GCC),,,,,,,,,,,,,1,1,,,,,,
NC_000913,3903374,SNP,A→C,bglB,,cryptic phospho-beta-glucosidase B,,,F110V (TTT→GTT),,,,,,,,,,,,,1,1,,,,,,
NC_000913,3947489,SNP,A→C,hdfR,,flhDC operon transcriptional repressor,,,L160W (TTG→TGG),,,,,,,,,,,,,,1,,,,,,
NC_000913,4003860,SNP,A→C,rarD,,putative chloramphenical resistance permease,,,F107V (TTT→GTT),,,,,,,,,,,,,1,1,,,,,,
NC_000913,4094823,SNP,A→C,rhaA,,L-rhamnose isomerase,,,V387G (GTC→GGC),,,,,,,,,,,,,,1,,,,,,
NC_000913,4127559,SNP,A→C,yiiX,,"putative lipid binding hydrolase, DUF830 family protein",,,G112G (GGT→GGG),,,,,,,,,,,,,,1,,,,,,
NC_000913,4128549,SNP,A→C,"metJ, metB",,"transcriptional repressor, S-adenosylmethionine-binding/cystathionine gamma-synthase, PLP-dependent",,,intergenic (‑154/‑123),,,,,,,,,,,,,,1,,,,,,
NC_000913,4133696,SNP,A→C,"metF, katG",,"5,10-methylenetetrahydrofolate reductase/catalase-peroxidase HPI, heme b-containing",,,intergenic (+190/‑139),,,,,,,,,,,,,1,1,,,,,,
NC_000913,4143217,SNP,A→C,frwC,,putative enzyme IIC component of PTS,,,M230L (ATG→CTG),,,,,,,,,,,,,1,1,,,,,,
NC_000913,4256722,SNP,A→C,dgkA,,diacylglycerol kinase,,,E29A (GAA→GCA),,,,,,,,,,,,,1,1,,,,,,
NC_000913,4272717,SNP,A→C,uvrA,,ATPase and DNA damage recognition protein of nucleotide excision repair excinuclease UvrABC,,,Y385* (TAT→TAG),,,,,,,,,,,,,1,1,,,,,,
NC_000913,4290993,SNP,A→C,nrfD,,"formate-dependent nitrite reductase, membrane subunit",,,Y173S (TAT→TCT),,,,,,,,,,,,,1,1,,,,,,
NC_000913,4304847,SNP,T→G,yjcS,,metallo-beta-lactamase superfamily protein,,,N584T (AAC→ACC),,,,,,,,,,,,,1,1,,,,,,
NC_000913,4321045,SNP,A→C,phnH,,ribophosphonate triphosphate synthase subunit,,,L68* (TTA→TGA),,,,,,,,,,,,,1,1,,,,,,
NC_000913,4372620,SNP,A→C,groL,,"Cpn60 chaperonin GroEL, large subunit of GroESL",,,L532F (TTA→TTC),,,,,,,,,,,,,1,1,,,,,,
NC_000913,4494164,SNP,T→G,idnD,,"L-idonate 5-dehydrogenase, NAD-binding",,,E81D (GAA→GAC),,,,,,,,,,,,,1,1,,,,,,
NC_000913,4494308,SNP,T→G,idnD,,"L-idonate 5-dehydrogenase, NAD-binding",,,Q33H (CAA→CAC),,,,,,,,,,,,,1,1,,,,,,
NC_000913,4623272,SNP,A→C,lplA,,lipoate-protein ligase A,,,F282L (TTT→TTG),,,,,,,,,,,,,1,1,,,,,,
NC_000913,4626686,SNP,A→C,radA,,DNA repair protein,,,N259H (AAC→CAC),,,,,,,,,,,,,1,1,,,,,,
NC_000913,3614957,SNP,A→C,nikA,,nickel/heme ABC transporter periplasmic binding protein,,,S431R (AGT→CGT),,,,,,,,,,,,,1,,,,,,,
NC_000913,4636416,SNP,T→G,creB,,response regulator in two-component regulatory system with CreC,,,F137C (TTT→TGT),,,,,,,,,,,,,1,1,,,,,,
NC_000913,3317072,SNP,A→C,nusA,,transcription termination/antitermination L factor,,,L152R (CTG→CGG),,,,,,,,,,,,,,,1,1,1,,,
